<?xml version="1.0" encoding="UTF-8"?>

<metadata xmlns:xsi="http://www.w3.org/2001/XMLSchema-instance" xsi:noNamespaceSchemaLocation="metadata.xsd">
	<site>
		<geometry>Punto</geometry>
		<title>Universidad Libre</title>
		<description>Es la única universidad que se encuentra en la zona y es de las principales universidades en Bogotá. De igual manera se encuentra el colegio de la Universidad Libre dentro de ésta.</description>
		<date>
			<year>2015</year>
			<month>06</month>
			<day>25</day>
		</date>		
		<location>
			<postalCode>111221</postalCode>
        	<city>Bogota</city>
		</location>
		<origin>
			<name>David</name>
			<surname>Obregon</surname>
		</origin>
	</site>
</metadata>